timestamp	commit	metric	value	status	description	hash
2026-03-16T00:10:15.477661	d403a0d	accuracy	0.800000	keep	iteration 1	26ff924a247e
2026-03-16T00:10:16.627773	d403a0d	accuracy	0.850000	keep	iteration 2	26ff924a247e
2026-03-16T00:10:17.772695	d403a0d	accuracy	0.850000	discard	iteration 3	26ff924a247e
2026-03-16T00:10:18.921350	d403a0d	accuracy	0.850000	discard	iteration 4	26ff924a247e
2026-03-16T00:10:20.081374	d403a0d	accuracy	0.850000	discard	iteration 5	26ff924a247e
2026-03-16T00:10:21.245349	d403a0d	accuracy	0.850000	discard	iteration 6	26ff924a247e
2026-03-16T00:10:22.383534	d403a0d	accuracy	0.850000	discard	iteration 7	26ff924a247e
2026-03-16T00:10:23.554272	d403a0d	accuracy	0.850000	discard	iteration 8	26ff924a247e
2026-03-16T00:10:24.722067	d403a0d	accuracy	0.850000	discard	iteration 9	26ff924a247e
2026-03-16T00:10:25.876854	d403a0d	accuracy	0.850000	discard	iteration 10	26ff924a247e
2026-03-16T00:10:27.114383	d403a0d	accuracy	0.850000	discard	iteration 11	26ff924a247e
2026-03-16T00:10:28.262749	d403a0d	accuracy	0.850000	discard	iteration 12	26ff924a247e
2026-03-16T00:10:29.402187	d403a0d	accuracy	0.850000	discard	iteration 13	26ff924a247e
2026-03-16T00:10:30.548693	d403a0d	accuracy	0.850000	discard	iteration 14	26ff924a247e
2026-03-16T00:10:31.710487	d403a0d	accuracy	0.850000	discard	iteration 15	26ff924a247e
2026-03-16T00:10:32.855331	d403a0d	accuracy	0.800000	discard	iteration 16	26ff924a247e
2026-03-16T00:10:34.006779	d403a0d	accuracy	0.800000	discard	iteration 17	26ff924a247e
2026-03-16T00:10:35.176804	d403a0d	accuracy	0.800000	discard	iteration 18	26ff924a247e
2026-03-16T00:10:36.331440	d403a0d	accuracy	0.750000	discard	iteration 19	26ff924a247e
2026-03-16T00:10:37.475117	d403a0d	accuracy	0.750000	discard	iteration 20	26ff924a247e
